{
  "annotation": "2 Jgg 1791, 1792\n\nHalle (Dost)\n\nHrsgg: F. S. Mursinna; Faselius",
  "created": "2026-06-11 10:17:36.311Z",
  "edit_comment": "",
  "edit_state": "Edited",
  "frequency": "jährlich",
  "musenalm_id": 2136,
  "pseudonyms": "",
  "refs": "K 107; L/R 175",
  "title": "Taschenbuch, Akademisches",
  "updated": "2026-06-11 10:17:36.311Z",
  "editor": "",
  "entries": [
    "otr7ug7zw3fht62",
    "29dkmcs97neus82"
  ],
  "related_entries": []
}
