{
  "annotation": "3 Jgg 1837–1839 \n\nAschaffenburg (Pergay)",
  "created": "2026-06-11 10:17:36.238Z",
  "edit_comment": "",
  "edit_state": "Edited",
  "frequency": "jährlich",
  "musenalm_id": 1475,
  "pseudonyms": "",
  "refs": "K 39; nicht bei L/R",
  "title": "Cölestina",
  "updated": "2026-06-11 10:17:36.238Z",
  "editor": "",
  "entries": [
    "lotgdn0gpnhi4ka",
    "atz48pfg0uhbsa2",
    "etaohtke8zljz1m"
  ],
  "related_entries": []
}
