{
  "annotation": "Leizig (Sommer)\n\nTA von: Neuestes Taschenbuch für Frauenzimmer edlerer Bildung. Von Eulalia Gutwill. Erster Jahrgang. Mit Kupfern. Leipzig, in der Sommerschen Buchhandlung. 1801 (Alm-1103)",
  "created": "2026-06-11 10:17:36.300Z",
  "edit_comment": "",
  "edit_state": "Edited",
  "frequency": "jährlich",
  "musenalm_id": 2051,
  "pseudonyms": "",
  "refs": "nicht bei K; nicht bei L/R",
  "title": "Taschenbuch für Frauenzimmer edlerer Bildung",
  "updated": "2026-06-11 10:17:36.300Z",
  "editor": "",
  "entries": [
    "0gccbgmhpa9gio8"
  ],
  "related_entries": []
}
